HOLBECK AT EAST NESS BRIDGE,,,5.116666667,0.073166667,,,469612,478178
HOLBECK AT HOLBECK BRIDGE,,,4.224166667,0.091666667,,,466925,477345
HOLBETON STW,,,,,11.5,,262030,50220
HOLBROOK STW F/E,,,,,27.63636364,,616809,235979
HOLCOMBE ROGUS STW FE,,,,,13.33333333,,306000,118500
HOLDENHURST STW,,,,,8.916666667,,413300,95230
HOLDERNESS DRAIN AT GREAT CULVERT,,,5.97125,0.05975,,,511450,435594
HOLDERNESS DRAIN AT SALTS HOUSE BRIDGE,,,7.155375,0.11175,,,513773,432254
HOLE-IN-THE-WALL FOOTBRIDGE,,,2.386363636,0.027545455,,,360460,228415
HOLLACOMBE LANDFILL SITE,,,,,4.728571429,11.9,236910,103900
HOLLAND BCH OFF CHEVAUX DE FRSE PT 11350,,34.4,,,,,622450,217650
HOLLESLEY STW F/E FLOW <48.6 L/S,,,,,14.75,,636000,244200
HOLLICARRS HOLIDAY PARK - ESCRICK,,,,,30.5,,463020,439460
HOLLICOMBE BEACH (23900),,21.3,,,,,289800,62150
HOLLICOMBE STREAM AT BEACH,,2611,,,,,289845,62317
HOLLOW BOTTOM SPRING,,,0.196,0.0029,,,494150,293650
HOLLOWELL STW F/E,,,,,13.5,,469490,271883
HOLLY WATER AT CHERITON MILL,,,2.084545455,0.103909091,,,285982,107113
HOLLY WATERU/S POUGHILL STW,,,1.044,0.04375,,,286520,108330
HOLLYCOMBE HOUSE,,,,,17,,485300,128930
HOLME (NEW WORKS) STW - FINAL EFFLUENT,,,,,3.026666667,,351896,478499
HOLME AT QUEENS MILL ROAD,,,2.8875,0.09925,,,414193,415740
HOLME BECK PTC UNNAMED TRIB HOLME STW,,,1.6,0.021,,,351849,478564
HOLME DYKE AT FISKERTON,,,4.775,0.027,9.5875,,473337,350093
HOLME FARM STW F/E NORMANBY BY SPITL,,,,,7.9,,500260,388130
HOLME HEAD BH,,,0.196,0.01,,,358630,469780
HOLME LACY BRIDGE,,,2.474166667,0.034833333,,,356800,236498
HOLME LACY STW.,,,,,22.5,,355730,235590
HOLME ON SPALDING MOOR STW FINAL,,,,,7.616666667,,479655,437527
HOLME STW F/E,,,,,11.18181818,,519800,287110
HOLMES CHAPEL WWTW,,,,,19.325,,375180,367600
HOLMES DIKE AT LITTLE SKIPWITH,,,5.296222222,0.023222222,,,464760,438519
HOLMESFIELD SETTLED STORM SEWAGE,,,,2.4,7.6,,432800,377900
HOLMESFIELD TREATED SEWAGE EFFLUENT,,,,,14.7,,432800,377900
HOLMWOOD STW,,,,,5.566666667,,518900,145000
HOLMWRANGLE FISH HATCHERY NO. 4,,,5,0.01,,,351770,549370
HOLMWRANGLE HATCHERY OUTFALL TO EDEN,,,,,3.75,,351727,549247
HOLNE STW FE,,,,,10,,270800,69300
HOLSWORTHY (DERRITON) STW FE,,,,,18.66666667,,233970,103180
HOLT FLEET MEADOWS HOLT FLEET,,,4.9775,0.1485,,,382330,263400
HOLT STW,,,,,7.666666667,,403400,104570
HOLT STW F/E,,,,,20,,606800,338900
HOLTON LE CLAY STW F/E,,,,,10.18181818,,529700,403100
HOLWELL CRESS  CRANBORNE,,,,,3.4125,5.175,407308,112497
HOLWELL STW,,,,,7.636363636,,371080,110780
HOLWELL STW STW F/E,,,,,8.666666667,,516300,233500
HOLY ISLAND STW,,,,,13.18181818,,412720,642490
HOLY WELL MALVERN WELLS A99/03E,,,0.676,0.01,,,377030,242330
HOLYWELL BAY BEACH (32000),,11.7,,,,,176520,59400
HOLYWELL LAKE STW,,,,,6.333333333,,310780,120680
HOLYWELL WTW SLUDGE LAGOON,,,,,5.333333333,,537020,127430
HOME FARM STW :SPARSHOLT,,,,,52,,434692,187816
HONEY PITTS PLANTATION (SPRING),1,,5.8,0.063,,5,366550,103840
HONEYBRIDGE STREAM DAYLANDS FM,,,4.6625,0.069375,,,516600,117300
HONEYCROOK BURN WHINNETLEY FARM RD BRGE,3.566666667,,,,6.466666667,220,382297,564948
HONICOMBE MANOR HOLIDAY VILLAGE,,,1.6,0.01,,,241200,70500
HONINGTON BECK HOUGH ROAD,,,8.48,0.22,,,493160,342939
HONINGTON STW F/E,,,,,31.25,,591500,274800
HONITON STW FE,,,,,6.875,,315400,101000
HOOBOROUGH BROOK - ACRESFORD,,,10.44,0.06325,,,429858,313151
HOOBOROUGH BROOK - OVERSEAL (B5004),,,0.20075,0.01,,,430100,315900
HOOE STW FINAL EFFLUENT,,,,,7.826666667,,569490,110120
HOOK NORTON STW,,,,,6.016666667,,436900,233500
HOOK SETTLED SEWAGE DISCHARGE,,,,,112.25,,476285,425517
HOOK WTW,,,,,5,,330750,105500
HOOKE MAIDEN NEWTON,,,3.6875,0.07375,,,359533,97673
HOOKE SPRINGS FISH FARM INLET,,,,,3.766666667,,353433,100696
HOOKE SPRINGS FISH FARM OUTLET,,,,,3.9,,353500,100300
HOOKLANDS LANE BRIDGE (OAKWOOD),,,3.532857143,0.112142857,,,513600,119000
HOOLPOOL GUTTER TO CENTRAL NEW CUT DRAIN,,,3.6205,0.4788,,,349956,377642
HOOP LANE LANGTON BY WRAGBY,,,,,25,,514475,374065
HOOTON DYKE AT ROCHE ABBEY EXIT POND,,,13.375,0.0735,9.15,,454390,389650
HOOTON LEVITT,,,9.038,0.1004,,,451021,391140
HOP FARM COUNTRY PARK STW,,,,,9.9,,566600,147750
HOPE COVE BEACH (25400),,35.47619048,,,,,267532,39726
HOPTON WELL HEAD GROUNDWATER,1,,22,0.081,,5,359320,326620
HORBLING STW F/E FLOW <12.2 L/S,,,,,16.08333333,,512308,334580
HORBURY (DUDFLEET) WPC WORKS FINAL EFF,,,,,15.16666667,,430013,417141
HORDEN STW,,,,,8.333333333,,443980,542580
HORLEY ( OXON ) STW,,,,,3.7,,442100,243300
HORLEY STW,,,,,4.358333333,,526800,143600
HORNBY STW HUMUS TANK EFFLUENT,,,,,12.16666667,,358042,468435
HORNCASTLE STW F/E,,,,,10.83333333,,525957,367453
HORNER WATER  AT BOSSINGTON 1,,,0.581,0.023375,3.8,,289928,147749
HORNING STW F/E,,,,,6.666666667,,635900,318100
HORNS CROSS STW FE,,,,,6.583333333,,238870,123200
HORNS LODGE FARM POINT B,,,,,13,,559221,149827
HORNSEA (08700),,20.45,,,,,520923,448005
HORNSEA STW FINAL EFFLUENT,,,,,9.75,,521631,447450
HORNSEY BRIDGE STW (POINT A),,,,,6.833333333,,356836,122961
HORNSEY WTW T/E SAMPLE POINT M,,,,,3.7,,530520,189910
HORNTON STW,,,,,9.133333333,,439700,244700
HORRABRIDGE STW FE,,,,,16.75,,249770,70428
HORSE BROOK DS M40 POLLUTION POND,,,8.82,0.166666667,,,426590,262213
HORSEY MERE (R.THURNE),,,0.485571429,0.01,11.1625,,644900,322100
HORSHAM STW FINAL EFFLUENT,,,,,8.095416667,,514860,129730
HORSLEY GATE FARM,,,0.196,0.016,,,425280,469950
HORSLEY WTW - SITE COMMISSION WASTEWATER,,,,,3,,409484,565745
HORSMONDEN STW,,,,,17.58333333,,572178,140534
HORSTED KEYNES STW FINAL EFF,,,,,4.1,,537640,128300
HORTHAM BK AT WEBBS WOOD,,,2.452125,0.117875,,,362657,181724
HORTON BROOK,,430.8947368,,,,,501070,174992
HORTON CUM STUDLEY STW,,,,,6.125,,460589,211993
HORTON IN RIBBLESDALE STW EFFLUENT,,,,,9.65,,380715,471894
HORTON QUARRY SETTLEMENT LAGOONS,,,,,29.5,,380070,471910
HORTON QUARRY VEHICLE WASH AND SW RUNOFF,,,,,26,,380407,472270
HORWICH STW FINAL EFFLUENT.,,,,,5.916666667,,362272,410980
HORWOOD STREAM AT EAST-THE-WATER,,,3.402375,0.059125,,,246706,127172
HOTON BROOK AT COTES,,,8.655,0.784166667,23.45833333,,455247,321065
HOTON STW STORM SEWAGE VIA REED BED,,,,,8,,457630,322840
HOUGHTON ON THE HILL,,,0.518142857,0.048428571,,,467657,303709
HOUGHTON VAUGHAN LTD OIL BLENDERS,,,,,32.125,,377169,397508
HOUGHTON-ON-THE-HILL STW,,,,,5.25,,466900,303440
HOUGHWOOD GOLF CLUB,,,0.196,0.01,,,351860,401430
HOUND GREEN H/S ( NEW ) STW :MATTINGLEY,,,,,7.866666667,,472900,159200
HOUSE ADIT WIREGILL,1.077777778,,,0.01,3,226.6666667,397500,530130
HOUSELOP BECK AT SNIPE GATE,,,3.545,0.3175,,,410676,537444
HOVE FIRST AVENUE BATHING (15000),,52.9,,,,,529225,104232
HOVERINGHAM,,,6.8675,0.225,,,469823,345719
HOVETON GREAT BROAD,,,,,11.24,,631700,316500
HOVINGHAM WPC WORKS FINAL EFFLUENT,,,,,7.5,,466900,476000
HOW CAPLE BRK AT TOTNOR BRIDGE,,,4.36,0.093083333,,,359680,231100
HOWDALES,,,0.196,0.01,,,541592,390878
HOWDEN RES ON RIVER DERWENT - DWD SMPT,,,0.476,0.01,4.028571429,,416845,392561
HOWDEN STW FINAL EFFLUENT,,,,,38,,475399,426914
HOWDON STW SECONDARY TREATED SEWAGE,,,,,16.16666667,,433650,566570
HOWE HILLS (NRA 23),,,0.196,0.01,,,433600,524600
HOWES BECK U/S INTAKE,,,0.027,0.0024,,,350326,517722
HOXNE STW F/E,,,,,22,,618800,276900
HOYLANDSWAINE WPC WORKS FINAL EFFLUENT,,,,,10.75,,426800,405500
HOYLE MILL STREAM A638,,,5.993416667,0.065083333,,,444498,415857
HUBBARDS BARN B/H DOMESTIC SUPPLY,,,12,0.03,,,586040,334660
HUBY BURN WTW DISCHARGE,,,,,5,,454180,465430
HUD5 - MARL BK U/S CONF WITH HUD4 TRIB,1.175,,,,3.65,28.25,395184,529103
HUDDERSFIELD (COOPER BRIDGE) WPC FINAL,2.841666667,,,,11.11666667,30.33333333,418100,420700
HUDDERSFIELD STW - COLNE BRIDGE PLANT,3.058333333,,,,13.11666667,26.25,417559,420062
HUDESHOPE BECK D/S MARL BECK,1.385714286,,,,6.314285714,19.14285714,394910,528730
HUDESHOPE BECK U/S MINES,2.4,,,,3,6.714285714,394140,529840
HUDESHOPE BK AT MIDDLETON IN TEESD,1.758333333,,0.20225,0.01,3.108333333,23.41666667,394710,525790
HUDESHOPE BK AT ROAD BR U/S MARL BK,1.344444444,,,,3,14.36666667,394483,529223
HUGHENDEN STREAM AT BELLFIELD ROAD,,,5.6075,0.019875,,,486354,193699
HULL & TRIBS: SOURCE TO HUMBER - AD HOC,,,,,22,,510100,428300
HULL U/S BETHELLS BRIDGE,,,11.10083333,0.043166667,,,507956,451206
HULL WWTW - FINAL EFFLUENT,,,,,17.58333333,,516188,429092
HULLAVINGTON STW,,,,,19.75,,389600,182840
HULTON LANE ENDS WWTW,,,,,22.375,,376300,404030
HUMBER & TRIBS TO SPURN POINT - AD HOC,,938.125,,,,,540049,410257
HUMBER LPG TERMINALS KILLINGHOLME,,,,,26,,518166,417860
HUMBLETON BECK AT BACK LANE ELSTRONWICK,,,9.949166667,0.155083333,,,523522,432463
HUMMER BECK AT HUMMERBECK BRIDGE,,,3.87,0.54875,,,418805,525440
HUMPHREY HEAD CENTRE PRIV STW TO GROUNDW,,,,,18,,338930,474640
HUMSHAUGH STW,,,,,10.875,,392150,570750
HUMSHAUGH STW - WHEN FLOW EXCEEDS 2.1L/S,,,,,11.1875,,392100,570500
HUNDON STW F/E,,,,,16.33333333,,574376,248055
HUNDRED FOOT RIVER EARITH RD.BR.,2.844444444,,7.861111111,0.271111111,7.622222222,6.7,539315,274729
HUNDREDHOUSE LANE BRIDGE,,,1.66,0.04225,6.575,,584915,120051
HUNGARTON STW FE,,,,,2.083333333,,468570,306900
HUNGERFORD STW,,,,,10.10833333,,435385,168183
HUNMANBY WPC WORKS FINAL EFFLUENT,,,,,8.583333333,,510430,477910
HUNTACOTT WATER AT BROOKLAND WOOD,,,1.044818182,0.020527273,,,270437,114966
HUNTINGDON STW F/E,,,,,11.16666667,,526330,271280
HUNTLEY BROOK WINFORD BRIDGE,,,6.26375,0.14875,,,375230,222580
HUNTON STW FINAL EFFLUENT,,,,,8.2,,419470,492120
HUNTSHAW WATER AT BRIDGE AT VANS WOOD,,,2.462,0.0325,,,247910,121470
HURDCOTT STW FE,,,,,8.416666667,,416680,133760
HURLEY BROOK AT WAPPENSALL,,,2.866363636,0.098909091,,,366542,313873
HURLEY STW,,,,,9.666666667,,482900,183600
HURN AIRPORT STW FE,,,,,18,,412400,98000
HURST GREEN ET WORKS HUMUS TANK EFFLUENT,,,,,9.125,,369127,437740
HURST GREEN STW FINAL EFFLUENT,,,,,3.816666667,,572650,126150
HURTWOOD HOUSE STW EAST,,,,,16,,510164,142698
HUSBANDS BOSWORTH STW F/E,,,,,3,,464474,284872
HUSTHWAITE STW FINAL EFFLUENT,,,,,5.65,,451500,475300
HUSTLEDOWN STW FINAL EFFLUENT,,,,,15.79166667,,421300,551800
HUTTOFT BEACH:TRANSECT (09300),,15.83333333,,,,,554698,377620
HUTTON BECK AT HUTTON HALL BRIDGE,,,4.12375,0.0525,,,412508,512647
HUTTON BECK AT KELSEY LANE,,,0.13681,0.00286,,,470277,490702
HUTTON BECK BELOW WEST MIDDLETON FARM,,,5.02,0.073,,,413254,512524
HUTTON ROOF STW EFFLUENT (SETTLEMENT),,,,,7.166666667,,357053,477894
HUTTON RUDBY STW,,,,,10.16666667,,446540,506920
HUYTON WWW FINAL EFFLUENT,7.780833333,,,,7.208333333,,344801,388644
HYCEMOOR STW TO THE IRISH SEA,,,,,14.1,,308730,489810
HYDE BROOK STOKE ORCHARD CONF SWILGATE,,,13.35375,0.29075,,,392360,226980
HYDE BROOK US BROCKHAMPTON STW,,,1.82075,0.047625,,,395170,225840
HYDE BROOK US STOKE ORCHARD STW,,,10.77416667,0.1335,,,392630,226790
HYDE WWTW FINAL EFFLUENT,,,,,8.061666667,,393788,394891
HYNDBURN ET WORKS AERATION PLANT EFF,6.925,,,,4.965833333,,375741,433750
HYTHE (13500),,22.25,,,,,616000,134000
HYTHE LAGOON (HYTHE END WEST),1.05,,0.193,,3.4,7.5,501775,172751
ICI EAST CLIFTON NORTH LANDFILL SITE,,,,,240,,352690,379040
ICI HOLFORD SAMPLING POINT 2 DITCH,,,1.59,0.3,72,,372864,374659
ICI HOLFORD SAMPLING POINT 3 POND,,,0.196,0.078,10,,372895,374635
ICI HOLFORD SAMPLING POINT 4 DITCH,,,2.15,0.36,23,,372790,374640
ICKLESHAM STW,,,,,10.07916667,,589201,116473
IDEFORD STW FE,,,,,22,,289100,76900
IDEN GREEN STW FINAL EFFLUENT,,,,,3.240625,,580669,131729
IFIELD FARM,,,,,15,,568500,171000
IGHTFIELD STW FINAL EFFLUENT,,,,,3.333333333,,359100,337880
ILAM (RGS) SPRING,,,3.25,0.013,,,413971,350750
ILCHESTER STW,,,,,5.833333333,,351562,122814
ILFRACOMBE   (TUNNELS BEACH) (34450),,22.8,,,,,251508,147845
ILFRACOMBE (HELE) BEACH (34600),,130.6,,,,,253602,147830
ILFRACOMBE STW FE,,,,,18,,252710,147584
ILKLEY WPC WORKS FINAL EFFLUENT,,,,,11.83333333,,412500,448400
ILLOGAN STREAM AT ILLOGAN WOODS,110,,,,780,830,166192,44994
ILMINSTER STW,,,,,14.41666667,,335837,116367
ILTON STW,,,,,17.08333333,,335802,118550
IMMINGHAM EAST TERMINAL IMMINGHAM DOCK,1.5,,,,3,5.95,520148,416236
IMMINGHAM STW F/E,,,,,12.83333333,,520799,414925
IMMINGHAM WEST TERMINAL,1.15,,,,3,27,519480,416670
INEOS HOLFORD SPT 1 ABOVE SITE,,,2.3,0.32,9.3,,372651,374671
ING BECK AT KETTLEWELL FARM,,,7.181545455,0.55,,,438501,498232
INGATESTONE STW F/E,,,,,13.41666667,,566414,199080
INGBIRCHWORTH DIKE D/S  INBIRCHWORTH STW,,,2.21875,0.095333333,4.733333333,,422732,405539
INGBIRCHWORTH DIKE U/S INGBIRCHWORTH SW,,,3.393333333,0.042666667,7.366666667,,422588,405713
INGBIRCHWORTH WPC WORKS FINAL EFFLUENT,,,,,11.61666667,,422700,405400
INGHAM BECK O/F TO RIVER TILL,,,14.65875,1.00125,,,490927,382208
INGHAM STW F/E,,,,,14.09090909,,494309,383109
INGLE BECK AT SCOSTHROP LANE,,,0.0911,0.0037,,,387592,460282
INGLEBY GREENHOW STW,,,,,8.833333333,,457925,506467
INGLEBY LN TE & PUMPED GW,,,,,13,,435000,327000
INGLETON ETW EFFLUENT FROM LAND TREATMNT,,,,,6.791666667,,368615,472690
INGLETON QUARRY DISCHARGE TO RIVER GRETA,,,,,5.4,,370350,474230
INGOLDISTHORPE STW F/E,,,,,4.333333333,,569890,332680
INGOLDISTHORPE STW WETLAND,,,,,8.833333333,,569608,332881
INGOLDMELLS MAIN DRAIN,,3278.916667,0.252,0.122636364,,,557430,368697
INGOLDMELLS NORTH BEACH:TRANSECT,,25.90909091,,,,,557350,368900
INGOLDMELLS SOUTH BEACH:TRANSECT (09600),,31.5625,,,,,557458,368217
INGOLDMELLS STW F/E,,,,,11.81818182,,555982,367621
INGREBOURNE AT A12 BRIDGE,,,2.695,0.166666667,,,556467,192158
INGREBOURNE AT A13 BRIDGE,7.1,,9.001428571,1.484285714,12.18571429,18.42857143,552370,182620
INGREBOURNE AT FROG ISLAND ABOVE THAMES,,,22.36,4.92,,,551090,181090
INGREBOURNE AT HACTON LANE,,,11.67916667,1.745833333,10.225,,554900,185910
INGREBOURNE AT HAROLD COURT RD,,,16.98,2.871428571,,,555900,191400
INLET BOSSINGTON ESTATE FISH FARM,,,,0.046,3.988888889,,434038,130812
INLET DAMERHAM FF HATCHERY,,,,0.011333333,,,411036,115028
INLET HILL DEVERILL CRESS EAST,,,,0.105375,,,386880,140310
INLET HILL DEVERILL CRESS NORTH,,,,0.047125,,,386989,140476
INLET HILL DEVERILL CRESS WEST,,,,0.1175,,,386800,140270
INLET WHEEL DUNCTON FF INLET,,,,,4.5,,496420,116600
INN AT WHITEWELL PSTW,,,,,8.4,,365910,446900
INNIS MOOR FFM INLET,,,,,8.975,,203380,56790
INNISMOOR TROUT FARM PENWITHICK,,,,,9.35,,203670,56760
INNOSPEC LTD PRIVATE SEWAGE PLANT,,,7.5025,1.755,11.2,,341800,376300
INOVYN CHLORVINYLS FRODSHAM MARSH O/F 63,21,,,,18,79,350600,378600
INSITE DEVELOPMENTS LADY VANE,,,10.4,0.073,,,559460,153160
INSITUTE OF FRESHWATER ECOLOGY NO 1,,,,,3,,338942,495578
INSKIP ET WORKS HUMUS TANK EFFLUENT,,,,,6.625,,345603,436025
INSTITUTE OF FRESHWATER ECOLOGY NO 2,,,,,3.05,,338942,495578
INTAKE POINT FROM FISH FARM HATCHERY,,,,,3,,367040,215310
INTAKE TO FROG ISLAND FISH FARM :ABINGER,,,,,9.05,,509257,147550
INVESTIGATION IN CATCHMENT 12N,1,,,,,100,235300,84900
INVESTIGATION IN CATCHMENT 15B,14,,,,,440,210700,59800
INVESTIGATION IN CATCHMENT 16A,1.4,,,0.574333333,13.075,24,209200,50000
INVESTIGATION IN CATCHMENT 21A,,9567.5,,,,,164100,24300
INVESTIGATION IN CATCHMENT 22A,54.41818182,,,,,275.0909091,141900,22800
INVESTIGATION IN CATCHMENT 26A,,7389.0625,,,,,202200,81400
IOW RAILWAY CO. LTD,,,,,12.35555556,,455700,89900
IPPLEPEN (NEW) STW FE,,,,,7.166666667,,282800,66800
IRCHESTER BROOK AT WOLLASTON LODGE,,,1.084,0.010333333,,,490657,264897
IREBY STW HUMUS TANK EFFLUENT,,,,,4.738333333,,324054,539264
IRESHOPE BURN AT IRESHOPE,1.3,,,,3,5.166666667,386757,538710
IRK AT HANSON BRIDGE PTC WHIT BROOK,,,1.325666667,0.055166667,8.383333333,,387460,406017
IRLAM STW FINAL EFFLUENT,,,,,12.11538462,,370269,391919
IRON BRIDGE,,,6.835,0.04125,,,443575,147363
IRONSBOTTOM STW :SIDLOW,,,,,9.1,,525000,146500
IRWELL AT FOOT BRIDGE AT SALFORD UNI,,,3.042222222,0.093,,,382258,399020
IRWELL AT REGENT RD BRIDGE (A57),,,3.37,0.182,30.6,,382615,397680
IRWELL U/S BURY GROUNDS GAUGING STATION,,,3.735,0.07175,9.375,,380134,411661
ISBOURNE RIVER POSTLIP HOUSE,,,3.173333333,0.012333333,,,401640,227410
ISBOURNE RIVER WORMINGTON,,,4.51,0.074875,,,403740,236360
ISFIELD,,,3.551111111,0.088888889,19.46666667,,544452,117370
ISLAND  FARM C BISHOP MIDDLEHAM 25-3-352,,,0.196,0.01,,,433811,530710
ISLAND FARM L BISHOP MIDDLEHAM 25-3-353,,,5.7,0.017,,,433801,530710
ISLEHAM STW F/E,,,,,11.6,,564820,275300
ISLIP STW ( NEW ),,,,,4.575,,453100,213900
ISLIP STW F/E,,,,,16,,499133,279624
ITCHELL WATER WORKS STW,,,,,23,,478600,150200
ITCHEN ABBAS TROUT FARM EFF,,,,0.061777778,5.155555556,,453566,132722
ITCHEN ABBAS TROUT FARM INLET,,,,0.039166667,5.177777778,,453937,132911
ITCHEN RIVER A425 THORPE BRIDGE UFTON,,,4.111375,0.101375,,,440290,261560
ITCHEN RIVER FORD FARM,,,4.117625,0.079,,,440440,262670
ITCHEN RIVER MARTON,,,5.9425,0.1365,,,440550,268810
ITCHEN RIVER US LONG ITCHINGTON STW,,,4.74,0.117777778,17.55555556,,441040,265070
ITCHEN TRIB AT BISHOP STOKE,,,7.455833333,0.061416667,,,447109,118324
IVER NORTH STW,,,,,6.225,,504376,180729
IVINGHOE STW F/E,,,,,6.833333333,,494100,217000
IVYBRIDGE STW,,,,,6.454545455,,263130,55570
IWERNE MINSTER STW,,,,,8.25,,386060,113910
IWERNE SPRINGS FISH FARM INLET,,,,,4.3,,386498,114201
IWERNE SPRINGS FISH FARM OUTFALL 2,,,,,3.95,,386500,114200
JACKMOOR BROOK AT YENDACOTT COPSE,,,4.89,0.035222222,,,290578,100875
JACOB STREAM AT NEETS VALLEY,,,1.372,0.02315,,,222553,100004
JAYWICK BEACH OPP BROOME WAY (11600),,30.23809524,,,,,614850,212800
JAYWICK STW F/E,,,,,14.66666667,,614210,214100
JEFFERY'S WOOD SPRING,,,3.9,0.01,,,553010,130830
JENNETS STREAM USCW TORRIDGE ESTUARY,,,2.20625,0.021,,,245310,125210
JOPES ADIT,1073.636364,,,,,469.0909091,226432,69747
JORDANS & RYVITA COMPANY (DOMESTIC),,,,,10,,511492,368687
JOSHUA'S BECK PTC WYRE,,,0.902333333,0.0775,,,355201,453853
JOSS BAY (12700),,35.05,,,,,639908,170099
JOWKIN WOOD MINEWATER DIS TO NADEN BROOK,1,,0.196,,6.9,5,385143,412948
JURY BROOK AT WORMBRIDGE MILL,,,7.0225,0.04475,,,341875,230945
JURY'S GUT SEWER U/S OF KENT PEN SLUICE,,,,,25.3625,,599602,118855
KABER STW EFFLUENT (SETTLEMENT ONLY),,,,,17.81166667,,379520,511670
KEADBY PUMPING STATION DRAIN,,,5.89875,0.16875,19.5375,,483510,411290
KEARBY WPC WORKS FINAL EFFLUENT,,,,,8.666666667,,432800,446700
KECKWICK BROOK AT NEWMOORE LANE,,,2.62625,0.205,30.4125,,356605,383549
KEDINGTON STW F/E,,,,,8.25,,570630,246015
KEELBY STW F/E,,,,,10.90909091,,516915,409862
KEELE QUARRY SETTLEMENT LAGOON TE,,,,,18,,378497,344963
KEEVIL STW,,,,,19.58333333,,392912,159239
KEGWORTH BROOK U/S OF LOCKINGTON MARSH,,,1.97125,0.03075,14.4875,,448490,329310
KEGWORTH STW FE,,,,,10.83333333,,448690,327530
KELBROOK BECK AT SOUGH BRIDGE,,,1.81775,0.052666667,,,390166,445307
KELFIELD STW,,,,,14.5,,458720,438270
KELLOE (EAST HETTON) STW,,,,,12.41666667,,433890,535910
KELLOE BECK 300 YDS D/S KELLOE STW,,,9.2675,0.49375,,,433705,535785
KELLOE BECK U/S KELLOE STW,,,5.73875,0.015125,,,434155,536100
KEMPLEY BROOK WINDCROSS,,,6.2275,0.2975,,,369290,232190
KEMPSFORD STW,,,,,11.11666667,,416600,197500
KEMPTON PARK WATERWORKS 300MM 'F' T/E :H,,,,,7.466666667,,510900,170900
KENDAL (NEW WORKS) STW FINAL FULLY TREAT,,,,,6.549166667,,351410,490120
KENN AND KENNFORD STW FE,,,,,11.08333333,,292800,85410
KENNACK SANDS (29200),,10,,,,,173410,16460
KENNET 100M ABOVE THAMES,,,5.773333333,0.10275,,,473015,173702
KENNET 200M BELOW HUNGERFORD STW,,,6.113333333,0.028333333,,,435550,168220
KENNET AT HUNGERFORD BRIDGE,,,6.873333333,0.038777778,,,434207,169208
KENNET AT INLET TO PADWORTH TROUT FARM L,,,,,10.28888889,,460500,166600
KENNET AT MARSH BENHAM,,,6.117777778,0.029222222,,,442300,167000
KENNET AT STITCHCOMBE MILL,,,8,0.043,5.272727273,,422730,169552
KENNET AT THATCHAM RAILWAY STATION,,,6.178888889,0.035,,,452736,166274
KENNET CATCHMENT EFFLUENT N.C.R.S,,,,,15,,500000,7
KENNET CATCHMENT RIVER N.C.R.S,,,,0.1604,17.35,,500000,7
KENNET INLET TO CHILTON ESTATE FISH FARM,,,,,7.6,,432925,170069
KENNET MAIN CHANNEL,,,6.4225,0.03925,,,436364,168174
KENNET VALLEY TROUT FARM :MILDENHALL,,,,,5.175,,421400,169600
KENNETT STW F/E,,,,,9.7,,569830,268950
KENT BECK @ KENT BRIDGE NEASHAM,,,3.95375,0.23375,,,432355,510160
KENT DITCH A229 DS CONF HAWKHU,,,4.41,0.438333333,15.96666667,,575918,128123
KENT DITCH AT BODIAM,,,3.42375,0.220875,,,578447,126767
KENT FISH FARM (OULTON) DISCHARGE,,,,,7,,391250,335070
KENTON AND STARCROSS STW FE,,,,,15.25,,297347,82848
KENWITH STREAM AT NORTHAM ROAD BIDEFORD,,,3.76375,0.211375,,,244860,127340
KERRY FOODS LTD. LITTLE ELLINGHAM,,,,,13.66666667,,601180,299400
KERSBROOK PRIOR TO BEACH AT BUDLEIGH,,2999.111111,,,,,307220,82031
KESSINGLAND STW F/E,,,,,11.16666667,,653200,285700
KESWICK GOLF CLUB TO GLENDERAMACKIN,,,,,8,,333157,525437
KESWICK REACH LODGE AND RETREAT,,,,,3.15,,319886,535516
KESWICK STW HUMUS TANK EFFLUENT,,,,,8.5,,324902,524854
KETTERINGHAM HALL STW F/E,,,,,33.5,,616910,302800
KETTLEBY BECK POOL END,,,9.95,0.12,,,500081,405635
KETTLEWELL WPC WORKS FINAL EFFLUENT,,,,,4.745454545,,396800,472200
KETTON STW F/E FLOW <12.2 L/S,,,,,8.4375,,498994,304407
KEWARD BROOK AT MILL,,,7.075,0.0695,,,353126,144015
KEWARD BROOK AT TILE CENTRE,,,6.01125,0.055625,,,353795,144762
KEX BECK KIRKBY MALZEARD,,,3.2375,0.030016667,,,424131,474400
KEYINGHAM WPC WORKS FINAL EFFLUENT,,,,,16.41666667,,522915,425064
KEYNES COUNTRY PARK LAKE 32 (11760),,161.85,,,,,402800,195800
KEYNSHAM STW,,,,,12.33333333,,366305,168812
KIBWORTH STW F/E,,,,,25.11764706,,469189,293422
KIDSGROVE STREAM AT MALKINS BANK,,2166.666667,9.33375,0.42625,8.6125,,376250,358956
KIDSGROVE WWTW FINAL EFFLUENT,,,,,2.3475,,383030,355080
KIELDER FISH HATCH OUTDOOR BROOD TANKS,,,,,3.725,,363300,593400
KIELDER FISH HATCHERY EFFLUENT,,,,,3.822222222,,363300,593400
KILHAM STW FINAL EFFLUENT,,,,,9.083333333,,506823,464137
KILK WATER U/S KILKHAMPTON STW,,,2.7775,0.0355,,,225043,111709
KILKHAMPTON STW FE,,,,,13,,224989,111643
KILLHOPE BURN @ KILLHOPE MUSEUM FORD (C),9.583333333,,,,3.516666667,90.5,382467,543243
KILLHOPE BURN AT COWSHILL,4.75,,,,4.416666667,115.3333333,385370,540545
KILLHOPE BURN N OF WEST FALL (WEARHEAD(M,1.977777778,,,,3.188888889,132.2222222,385632,539877
KILLINGHALL WPC WORKS FINAL EFFLUENT,,,,,12.58333333,,427200,459100
KILLINGTON LAKE SERVICE AREA PRIVATE STW,,,,,22.5,,358510,490980
KILN LANE STW,,,,,21.45,,458870,134110
KILNDOWN (NEW) STW,,,,,9,,570700,135050
KILTON BECK AT SKINNINGROVE,,,2.599,0.02766,,,471145,519210
KILTON STW,,,,,20,,316387,144063
KILVE STW,,,,,11,,314460,144250
KIMBOLTON STW F/E,,,,,14.75,,511700,265500
KIMMERIDGE BAY (19900),,10,,,,,390798,79094
KIMPTON FARM,,,17.6,7.95,93.5,,426130,146160
KIMPTON STW,,,,,3.725,,520425,218189
KING EDWARD SCHOOL STW :WITLEY,,,,,9.4,,495100,138700
KING JOHN HOUSE BOREHOLE,1.4,,6.3,0.011,,35,394480,117640
KINGERBY BECK,,,5.999166667,0.08375,,,504564,393147
KINGERBY BECK CATCHMENT,,,6.55125,0.049125,,,507962,392857
KINGS LYNN STW F/E,,,,,13.83333333,,560540,322220
KINGS SEDGMOOR DRAIN AT CRANDON BRIDGE,,,2.445142857,0.157142857,,,333078,139936
KINGS SOMBOURNE STM,,,9.69125,0.027,,,434839,130600
KINGS SOMBOURNE STW,,,,,4.4125,,434122,129177
KINGS SUTTON STW,,,,,6.166666667,,450200,235600
KINGSAND BEACH (26520),,274.3809524,,,,,243570,50500
KINGSBRIDGE STW POST UV,,,,,14.75,,273830,42400
KINGSCLERE STW,,,,,12.0975,,453075,160952
KINGSCLIFFE SPRING,,,2.2,0.0093,,,500689,297017
KINGSCLIFFE STW F/E,,,,,5.333333333,,501303,297350
KINGSEY CUTTLE BROOK ABOVE ICHI BAN FISH,,,,,27.6,,474790,204840
KINGSLAND STW,,,,,17.25,,345382,260536
KINGSLEY WWTW FINAL EFFLUENT,,,,,18.58333333,,356955,374466
KINGSMEAD,1.35,,0.196,,14.25,5,500984,175644
KINGSMEAD 1 (S),,121.35,,,,,501492,175311
KINGSMEAD ISLAND LAKE,,19.52631579,,,,,500608,175134
KINGSTON BAGPUIZE STW ( NEW ),,,,,5.858333333,,440294,197481
KINGSTON BROOK AT EAST LEAKE,,,5.571166667,0.143833333,16.75,,455497,326513
KINGSTON BROOK AT KINGSTON ON SOAR,,,12.2925,0.091583333,14.60833333,,449700,327800
KINGSTON BROOK AT WEST LEAKE,,,12.87666667,0.094416667,30.65,,452400,326300
KINGSTON SEYMOUR STW,,,,,6.833333333,,338994,168087
KINGSTON STW FE,,,,,10,,263900,47400
KINGSTON STW S LAGOON FINAL EF,,,,,3,,540399,108105
KINGSTONE AND MADLEY STW FE,,,,,5.842105263,,342500,237100
KINGTON STW,6.666666667,,,,15.83333333,,330652,257042
KINNERLEY STW FE,,,,,5,,333978,320744
KINNERSLEY BROOK C/F WYE,,,4.044166667,0.1635,,,332745,247120
KINSON SEWAGE TREATMENT WORKS,,,,,16.91666667,,408610,96510
KINTBURY STW,,,,,12.66666667,,439500,167100
KIPLINGCOTES FARM 2/26/32/159,,,8.3,0.01,,,493386,445215
KIRBY CANE WTW - FILTER BACKWASH,,,,,3,,637633,292582
KIRD FREEHOLD COPSE,,,2.061142857,0.018442857,,,497318,128951
KIRDFORD STW FINAL EFFLUENT,,,,,11.15833333,,501750,126010
KIRK BECK PTC WHITE LYNE,,,0.244547619,0.010595238,5.75952381,,354914,574500
KIRK HAMMERTON WPC WORKS FINAL EFFLUENT,,,,,36.08333333,,447100,455500
KIRK SMEATON WPC WORKS FINAL EFFLUENT,,,,,13.95,,453342,416190
KIRKBAMPTON STW HUMUS TANK EFFLUENT,,,,,7.625,,330245,557001
KIRKBRIDE STW HUMUS TANK EFFLUENT,,,,,21,,323635,556887
KIRKBY (LITTLE) BROOK ABOVE CONFL ALT,,,5.67,0.202,,,340257,397643
KIRKBY BROOK ABOVE CONFLUENCE WITH SIMON,,,7.21,0.782,,,341012,399686
KIRKBY CUM OSGODBY STW F/E,,,,,31.66666667,,506160,392980
KIRKBY FLEETHAM STW FINAL EFFLUENT,,,,,17.36363636,,428980,494090
KIRKBY IN ASHFIELD STW FE (HUMUS TANKS),,,,,10,,448180,354920
KIRKBY INDUSTRIAL ESTATE 72 INCH OUTFALL,,,,,27.5,,342801,399162
KIRKBY LA THORPE STW F/E,,,,,5.583333333,,510133,344848
KIRKBY LONSDALE STW HUMUS TANK EFFLUENT,,,,,12.83333333,,361483,477879
KIRKBY MALZEARD WPC WORKS FINAL EFFLUENT,,,,,16.08333333,,424700,474200
KIRKBY STEPHEN STW HUMUS TANK EFFLUENT,,,,,17.59090909,,377169,510446
KIRKBY THORE STW HUMUS TANK EFFLUENT,,,,,17.25,,363186,525122
KIRKBYMOORSIDE STW FINAL EFFLUENT,,,,,16.41666667,,470450,485680
KIRKLAND STW HUMUS TANK EFFLUENT,,,,,2.453333333,,307349,517438
KIRKLEVINGTON STW,,,,,4.75,,442800,510100
KIRKLINGTON STW FE,,,,,2.5,,468430,357390
