Site,Copper,Escherichia coli : Confirmed : MF,Nitrate as N,"Orthophosphate, reactive as P","Solids, Suspended at 105 C",Zinc,x,y
SOUTH CERNEY AERODROME STW,,,,,12.4,,404700,198900
SOUTH CERNEY PRIMARY SCHOOL,,,18.69083333,0.454166667,,,404339,196630
SOUTH CREAKE CHALK OBS. B/H 1,,,11,0.21,,,585640,336240
SOUTH CREAKE GRAVEL OBS. B/H 2,,,9.8,0.25,,,585640,336240
SOUTH DIKE AND GRAYFLEET DRAIN,,,7.6395,0.046125,,,545576,393455
SOUTH DRAIN AT AVALON FARM,,,2.253333333,0.073333333,,,346891,138052
SOUTH ELMSALL WPC WORKS FINAL EFFLUENT,,,,,12.66666667,,448400,410700
SOUTH FERRIBY SPRING,,,20,0.0059,,,498880,421013
SOUTH HANTS SUN CLUB STW,,,,,28.66666667,,460247,110062
SOUTH HOLLAND MAIN DRAIN AT SHELL BRD,,,1.383090909,0.038272727,,,534209,316105
SOUTH HYKEHAM,,,3.507545455,0.102545455,,,493709,364781
SOUTH KILLINGHOLME BH,,,0.196,0.01,,,512980,415870
SOUTH LEIGH STW,,,,,11.5875,,439400,208400
SOUTH LODGE STW NEW,,,,,5.4,,521924,125277
SOUTH MILTON STW FE,,,,,7.416666667,,268700,42400
SOUTH MOLTON STW FE,,,,,23.83333333,,272300,125600
SOUTH MORETON STW,,,,,3.7,,456551,188426
SOUTH MUCHLARNICK FARM,1,,0.196,0.012,,5.2,221720,56400
SOUTH PERROTT STW,,,,,12.66666667,,347027,107397
SOUTH PETHERTON STW,,,,,12.08333333,,343024,117542
SOUTH SHIELDS (05300),,13.55,,,,,437900,567400
SOUTH TYNE AT ALSTON,,,0.269636364,0.013727273,3.327272727,,371635,546165
SOUTH TYNE AT ALSTON GAUGING STATION,1.988888889,,,,3.388888889,48,371544,546531
SOUTH TYNE AT BARDON MILL,,,0.45998,0.00655,,,376888,564057
SOUTH TYNE AT FEATHERSTONE GAUGING STN,1.866666667,,,,3.469230769,106.5833333,367206,561066
SOUTH TYNE AT HAYDON BRIDGE,3.22,,0.352666667,0.010916667,6.29,69.5,384325,564285
SOUTH TYNE AT WARDEN BRIDGE,1.666666667,,0.4205,0.012083333,24.14166667,106,391050,565950
SOUTH TYNE JUST D/S ROTHERHOPE CLEUGH,2.2,,,,8,46,371436,543603
SOUTH WINCHESTER GOLF CLUB STW,,,,,28.33333333,,445000,127440
SOUTH WOLD FARM,,,8.6,0.01,,,492267,444140
SOUTH WRAXALL STW,,,,,12.81818182,,383600,163990
SOUTHBOURNE (19020),,10,,,,,414800,91060
SOUTHBROOK CRESS SETTLEMENT,,,,,3.425,9.714285714,385080,94000
SOUTHEND STW,,,,,39.91666667,,588132,187536
SOUTHERGATE WWTW TO S'GATE BECK,,,,,6.375,,322410,480870
SOUTHERN END OF CHILDRENS BEACH,,64.52941176,,,,,402648,195789
SOUTHERY MILL DROVE STW F/E,,,,,15.16666667,,562040,293990
SOUTHLANDS SCHOOL STW,,,,,15.5,,432457,97266
SOUTHLEIGH STRM,,,2.065,0.132,,,474731,106223
SOUTHMINSTER NEW STW F/E,,,,,9.333333333,,595980,198700
SOUTHPORT AT SOUTHPORT (41500),,189.2727273,,,,,332200,417900
SOUTHPORT STW FINAL EFFLUENT,,20.60740741,,,12.95833333,,336940,420710
SOUTHPORT WWTW - PRE UV EFFLUENT,,,,,11.24,,336940,420710
SOUTHREPPS STW F/E,,,,,15.41666667,,626500,334800
SOUTHSEA EAST EC SITE (16600),,151.7,,,,,465000,98080
SOUTHWAITE STW HUMUS TANK EFFLUENT,,,,,20,,344958,546349
SOUTHWICK (15100),,25.35,,,,,524358,104728
SOUTHWICK STW,,,,0.51875,3,,461787,108749
SOUTHWOLD BEACH AT PIER (10830),,17.5,,,,,651300,276700
SOUTHWOLD STW F/E,,,,,31.66666667,,649900,275600
SOUTHWOOD   TIVERTON,9.7,,2.35,0.0365,,135.5,293640,109290
SOUTHWOOD F FM - INLET 1 (TOP),,,,,7.633333333,,263295,136207
SOUTHWOOD F FM - NEW OUTLET,,,,,4.066666667,,262910,136070
SOW BROOK NEW BILTON ROAD BRIDGE,,,4.29125,0.127,,,448580,275530
SOWE RIVER A45 ROAD BRIDGE,,,4.16,0.15775,,,434570,275630
SOWE RIVER BAGINTON MILL,,,4.860833333,0.132166667,,,433810,275310
SOWE RIVER STONELEIGH,,,14.66875,0.082125,,,433230,272740
SPALDING STW F/E,,,,,45,,526214,325062
SPARK BRIDGE STW HUMUS TANK EFFLUENT,,,,,8.318181818,,330718,484663
SPARKFORD STW OUTLET 1,,,,,6.142857143,,360428,125023
SPARKFORD STW OUTLET 2,,,,,12,,360505,125063
SPARKWELL STW FE,,,,,9.75,,258300,57100
SPARROW GILL AT BEECH FARM,,,0.409333333,0.0265,,,353276,454506
SPARSHOLT STW,,,,,28.66666667,,434500,188000
SPASTICS SOC TIXOVER GRANGE STW,,,,,8.5,,498308,301862
SPECKLED WOOD,,2750.526316,,,,,583349,111283
SPELDHURST STW,,,,,6.666666667,,555522,142029
SPELSBURY STW,,,,,6.25,,435100,221200
SPEN BECK AT A644 ROAD BRIDGE,,,2.46875,0.0585,,,423064,420513
SPEN BECK AT PONDEROSA,,,2.584545455,0.047090909,,,421940,422652
SPETISBURY SPRINGS,,,11,0.018,,,390249,102904
SPILSBY STW F/E,,,,,20.41666667,,542112,364518
SPINKSBURN BECK AT WYDRA BRIDGE,,,0.196,0.017,,,420186,454692
SPINNYFORD BROOK,,,4.039166667,0.030833333,,,424635,344260
SPITAL BROOK AT HADYHILL.,,,3.761666667,0.110833333,,,439088,370378
SPITAL BURN AT NORTH SEATON ROAD,,1660.368421,,,,,430429,587047
SPITAL BURN AT SPITAL BURN ALLOTMENTS,,6921.25,,,,,430778,587201
SPITTAL (03600),,85.75,,,,,400800,651500
SPRATFORD STREAM - 300M D/S B3181,,,7.187777778,0.185555556,,,302699,109296
SPREYTON STW FE,,,,,7.083333333,,269800,97500
SPRING AT BURGH WOOD,,,3.5,0.01,,,572759,127657
SPRING AT LUD WELL,,,3.8,0.01,,,412350,362490
SPRING AT PEMBURY WALKS,,,2.5,0.01,,,561847,142320
SPRING AT POPE FARM,,,3.5505,0.0385,,,589119,149257
SPRING AT SUNBEAM WATERCRESS,,1,11,0.036,,,429310,122812
SPRING AT TREBOY FARM ST CLETHER,24,,2.4,0.01,,14,219406,83854
SPRING BK @ FOXDENTON LN U/S OLDHAM WWTW,,,1.1875,0.097,13.15,,389108,404803
SPRING FEED U/S RYE HOUSE TROUT FARM,,,,,5.377777778,,463237,482245
SPRING FROM SPOIL WIREGILL,1.266666667,,,,3,182.2222222,397900,529780
SPRING GARDENS W/CRESS BEDS,,,,,,6.266666667,479900,106500
SPRING GARDENS WATERCRESS INLET,,,,0.019777778,,,457712,131639
SPRING GARDENS WATERCRESS OUTLET 1,,,,0.018444444,4.5,,457643,131723
SPRING GARDENS WATERCRESS OUTLET 2,,,,0.018666667,5.744444444,,457559,131778
SPRING NEAR HIGH ROCKS,,,2.4,0.01,,,555559,138192
SPRING SOUTH OF KNOWLMERE MANOR,,,0.786,0.048,,,367950,449547
SPRINGVALE WATERCRESS BEDS,,,,0.015875,4.0375,,448619,132202
SPRINGVALE WATERCRESS BEDS INLET,,,,0.010428571,,,448535,132432
SPRINGVALE WATERCRESS BEDS INLET 2,,,,0.023,,,448562,132284
SPRINGWELL BROOK,,,9.859,0.182,,,506581,353974
SPRINGWELL SPRINGS ASHBY,1.9,,12,0.01,,5,504496,354705
SPRINK,,,3.5,0.01,3.15,,412600,361800
SPROUGHTON STW F/E,,,,,10.16666667,,613000,244600
SPT @ WOOLPACK,,,,,14,,597795,124438
SPT 1 BLELHAM BECK ADJ LOW WRAY BRIDGE,,,0.2335,0.01,,,337085,500962
SPURLSWOOD BECK AT TINKER HILLS,,,0.059818182,0.004427273,,,404938,526870
ST  DOMINICK STW FE,,,,,9.25,,241900,67100
ST AGNES STREAM AT TREVAUNANCE COVE,,16381.90476,,,,,172160,51600
ST AGNES STW FE,,,,,6.5,,171740,51430
ST ANN'S ALLOTMENTS BOREHOLE,,,14,0.01,,,458190,341760
ST ANNES NORTH AT STARR HILLS (41900),,289.4090909,,,,,330816,429775
ST ANNS LAKE,1.15,198.45,0.199,,6.6,5,503110,167911
ST ANTHONY'S WELL GWQN,,,4.2,0.044,,,366980,215730
ST AUSTELL (NORTH) STW FE,,,,,7.166666667,,204414,58174
ST CLEER SEWAGE TREATMENT WORKS,,,,,6.25,,226030,67930
ST CUTHBERTS MILL (NEW),,,,,11.025,,353007,146517
ST DENNIS STW FE,,,,,19.5,,194300,57600
ST DUNSTANS WELL,1,,2.8,0.034,,5,365899,147903
ST GENNYS (CRACKINGTON) STW FE TO WOODS,,,,,26.36363636,,215900,95900
ST GERMANS STW,,,,,10.75,,235940,57110
ST GILES (GRIDLEY CORNER) STW FE,,,,,10.25,,236550,90170
ST HELENS (18100),,102.0869565,,,,,463755,89160
ST HELENS STW FINAL EFFLUENT,,,,2.9125,10.88333333,,462400,88500
ST IVES STW F/E,7.961666667,,,,7.916666667,,531850,273440
ST JOHN'S BECK AT THRELKELD BRIDGE,,,0.268,0.0011,,,331469,524660
ST KEVERNE STREAM AT PORTHOUSTOCK,,,6.785714286,0.307142857,,,180580,21810
ST LAWRENCE STW F/E <=796 M3/DAY,,,,,7.142857143,,595521,204871
ST LAWRENCE STW F/E >796 M3/DAY,,,,,7.8,,595521,204871
ST LEONARDS - HATCHET STREAM,,,4.10625,0.235,,,440652,98426
ST LEONARDS ON SEA (14150),,62.1,,,,,579700,108700
ST LUKES STW,,,,,13.1,,357202,435795
ST MARGARETS BAY (13200),,108.2,,,,,636878,144490
ST MARGARETS STW,,,,,12,,356341,435268
ST MARY'S BAY (13700),,93.35,,,,,609300,127700
ST MARYBOURNE W.F BOURNE SIDE,,,,,3.7,5,442771,148929
ST MARYBOURNE W.F VIADUCT SIDE,,,,,4.4625,5.5375,443012,148983
ST MELLION STW (NR HORSEPOOL FARM),,,,,12.66666667,,238660,65890
ST NEOT RIVER AT ST NEOT BRIDGE,,10091.66667,0.780333333,0.0269,5.311111111,,218446,67861
ST NEOTS STW F/E,,,,,19.41666667,,519290,262010
ST OSYTH STW F/E,,,,,23.41666667,,610422,213214
ST PETERS POOL WELL HEAD FIELDS SPRING,,,3.935,0.00145,,,509353,319909
ST PETERS WELL,,,2.3,0.014,,,335330,238810
ST RONANS SCHOOL,,,,,24,,577910,130840
ST TEATH STW FE,,,,,14.33333333,,205988,80606
ST. AUSTELL (MENAGWINS) STW FE,4.2,,,,10.08333333,,201130,50860
ST. AUSTELL RIVER AT LANSALSON BRIDGE,,,0.979666667,0.0115,,,200890,54780
ST. AUSTELL RIVER AT PENTEWAN BRIDGE,4.166666667,,4.86,0.073777778,11.76666667,19.33333333,201749,47253
ST. BREWARD STW FE,,,,,9.5,,209100,76200
ST. BURYAN STW FE,,,,,6.5,,140800,25200
ST. COLUMB STW FE,,,,,6.25,,190500,64100
ST. COSMUS CLOSE STW,,,,,150,,600940,150330
ST. KEVERNE STW FE,,,,5.4,29,,179000,21400
ST. LAWRENCE STREAM U/S PENDEWEY BRIDGE,,4906.666667,4.4375,0.031625,,,204504,66999
ST. MABYN STW FE,,,,,8.416666667,,204300,75400
ST. MARGARET'S FARM,,,8.8,0.0145,,,557278,170238
ST. MAWES STW FE,,,,,7.25,,183800,33150
ST. NEOT RIVER AT COLLIFORD BRIDGE,,30.33333333,0.301,0.01,,,218111,70717
ST. NEOT RIVER AT TWO WATERS FOOT,,1250,1.257875,0.013875,,,218526,64911
ST. NEOT STW FE,,,,,14.5,,218800,67300
ST. STEPHEN (COOMBE) STW FE,,,,,20.08333333,,194140,50900
ST.ANNES AT ST.ANNES PIER (41800),,216.9,,,,,331491,428585
ST.BEES AT ST.BEES (45920),,17,,,,,295900,511700
ST.BRIAVELS STW.LOWER MEEND.,,,,,28.25,,355040,204600
ST.CATHERINE'S WELL STREAM BUBUP BRIDGE,,,15.31666667,0.293333333,8.718181818,,457350,398530
ST.GEORGES BARRACKS NORTH LUFFENHAM STW,,,,,3.333333333,,492590,304190
ST.MARYS BAY BEACH (24600),,22.7,,,,,293200,55010
ST.MILDREDS BAY (12400),,22,,,,,632687,170396
STADHAMPTON STW,,,,,17.35,,460047,197804
STAFFS/WORCESTER CANAL AT COMPTON BRIDGE,,,11.0325,0.3525,,,388300,298801
STAGG BROOK D/S WHITCHURCH WWTW,,,12.05125,0.2875,14.3875,,351310,341468
STAGG BROOK U/S WHITCHURCH STW,,,5.11125,0.1755,14.6,,351720,341610
STAGSDEN STW F/E,,,,,7.090909091,,499000,249600
STAINDROP STW,,,,,12.625,,414250,519810
STAINFIELD BECK - EAST ARM,,,9.6925,0.03175,,,517826,379537
STAINFIELD BECK - WEST ARM,,,7.13375,0.066,,,515397,378352
STAINTON FINAL EFFLUENT (QUARRY WATER),,,,,11.5,,455000,394200
STAINTON IN TEESDALE STW-FLOWS TO 4.9L/S,,,,,8.888888889,,406620,517570
STAINTON STW-FLOWS GREATER THAN 4.9L/S,,,,,12.16666667,,406620,517570
STAINTONDALE BECK AT WHITEHOUSE FARM,,,1.166666667,0.058,,,500238,497747
STAITHES BECK AT FOOTBRIDGE - RIDGE LANE,,,1.620714286,0.021857143,,,477518,517967
STALHAM STW F/E,,,,,9,,635850,325130
STAMBOURNE BK. NUN'S WALK,,,6.08475,0.19125,,,575707,238507
STAMBOURNE STW F/E,,,,,16.27272727,,572374,238772
STAMFORD BRIDGE NEW WPC WORKS FINAL,,,,,7.016666667,,470700,455400
STAMFORD STW F/E,,,,,32.45454545,,506994,306592
STAMFORDHAM STW,,,,,9.75,,408420,571925
STANBRIDGEFORD ADF STW F/E,,,,,7,,496200,222740
STANDLAKE STW,,,,,8.95,,440400,202300
STANDON LANE BRIDGE,,,1.10175,0.095125,,,513236,138605
STANDON STW,,,,,9.541666667,,539690,221780
STANFORD BROOK ABOVE HOCK FORD STW,,,3.076625,0.038125,,,495800,154140
STANFORD IN THE VALE STW,,,,,7.625,,434289,192940
STANFORD RIVERS STW,,,,,4.280833333,,554440,199570
STANGROUND LODE BUNTINGS LANE P'BOROUGH,,,6.67,0.01,,,519848,295965
STANHOPE BURN AT STANHOPE,1.033333333,,0.234777778,0.019455556,3.433333333,33,399012,539326
STANHOPE PLANT TRADE DISCHARGE,,,,,3.5,,447195,338546
STANHOPE STW FINAL EFFLUENT,,,,,12.41666667,,400650,537975
STANION LODGE ROAD,,,2.991714286,0.042885714,12.48857143,,491378,286552
STANION STW F/E,,,,,15,,492259,286815
STANLEY BROOK AT NUT BROOK AT CONF,,,1.246,0.038125,8.3125,,445241,341093
STANNINGFIELD STW F/E,,,,,7.083333333,,587800,256900
STANNON STREAM AT TRECARNE,,1410,0.94875,0.013625,,,209750,80530
STANSTED MOUNTFITCHET STW,,,,,5.975,,550090,224280
STANTON DREW STW,,,,,17.5,,360239,163210
STANTON HARCOURT STW,,,,,5.591666667,,442100,206000
STANTON ST JOHN STW,,,,,3.966666667,,458646,209716
STANTON STR.BARDWELL MILL BRIDGE,,,8.4075,1.8825,,,594100,274500
STANTON STW (DISCHARGE 1) FE,,,,,17.08333333,,426687,319262
STANTON STW F/E,,,,,4.1,,597200,273600
STANWAY SPRING G91/20,,,6.7,0.01,,,407400,232350
STAPLEFIELD STW FINAL EFFLUENT,,,,,6.666666667,,528000,127350
STAPLEFIELDS BR BLACK SEWER,,,1.491,0.061428571,,,517100,112300
STAPLEFORD (BESSEL LANE) STW FE,,,,,4.75,,448640,335840
STAPLEHURST STW,,,,,10.44583333,,579000,144600
STAPLETON BROOK AT WAYFORD BRIDGE,,,4.4725,0.113,,,347539,303812
STAPLETON PARK WPC WORKS FINAL EFFLUENT,,,,,10.11666667,,451500,419100
STAUNTON HAROLD BROOK AT RESERVOIR INLET,,,1.862555556,0.041011111,4.9625,,437700,321700
STAVELEY SEWAGE TREATMENT WORKS -TREATED,,,,,9.7,,444370,376610
STAVELEY STW HUMUS TANK EFFLUENT,,,,,6.772727273,,348292,498047
STAVERTON STW FE,,,,,11.75,,279500,63800
STEBBING BK.CONF.FT.BR.,,,11.9975,0.85,,,566660,220420
STEEPING RELIEF CHANNEL ELMS BRIDGE,,,3.962625,0.064625,,,550780,359870
STEEPING RIVER CROWS BRIDGE,,,5.78,0.088375,,,548149,359224
STEEPING RIVER MILL BRIDGE,,,7.2525,0.153666667,,,542930,364128
STEEPLE BAY HOLIDAY PARK STW,,,,,9.8,,592269,204154
STEEPLE BUMPSTEAD STW F/E,,,,,8.5,,568294,241823
STEEPLE CLAYDON STW F/E,,,,,22.91666667,,469967,228021
STEETLEY MANUFACTURING FACILITY STP,,,,,13.46666667,,455288,379169
STEWKLEY STW,,,,,5.5,,484988,224851
STEYNING STW FINAL EFFLUENT,,,,1.26125,13.91666667,,518650,111900
STIBBARD MOOR END STW F/E,,,,,8.666666667,,598050,328540
STIBBINGTON STW F/E,,,,,18.08333333,,509163,298325
STICKNEY STW F/E,,,,,11.83333333,,534875,356815
STILLINGFLEET BECK AT STILLINGFLEET,,,7.508333333,0.163333333,,,459332,440914
STILLINGTON WPC WORKS FINAL EFFLUENT,,,,,10.25,,459400,467600
STIPPERSTONES STW FINAL EFFLUENT,,,,,10,,336310,300620
STIRCHELL BROOK D/S OF CANN MILLS,,,4.768181818,0.212727273,,,386920,120874
STIRLING WAY FOOTBRIDGE WERRINGTON BROOK,,,5.468571429,0.137142857,,,516134,302623
STISTED STW F/E FLOW <5.09 L/S,,,,,13.27272727,,580285,224353
STITHIANS WTW SLUDGE PLANT D/C,,,,,6.833333333,,171950,36350
STOCK BECK ABOVE BARNOLDSWICK STW,,,1.0115,0.0605,,,387974,447896
STOCK BECK AT FOOTBRIDGE,,,5.66,0.285,,,386465,448800
STOCKBRIDGE STW,,,,,6.75,,435728,134472
STOCKLEY WPC WORKS FINAL EFFLUENT,,,,,10.4,,445900,367900
STOCKPORT STW COMBINED TO MERSEY,,,,,6,,386686,389584
STOCKS FARM EAST WALTON NORFOLK,,,15,0.013,,,573500,316800
STOGURSEY BROOK AT STOGURSEY,,,7.415714286,0.139,,,320500,142937
STOGURSEY STW,,,,,10.08333333,,320470,143372
STOKE ABBOT SPRING,1,,2.7,0.016,,5,345260,100700
STOKE ALBANY BK.ASHLEY MIDDLETON,,,8.89625,0.485,11.1875,,482779,291136
STOKE ALBANY STW F/E,,,,,20.16666667,,480622,288620
STOKE BK AT STONEY MIDDLETON CARVER,,,2.7625,0.036875,11.825,,423860,375303
STOKE BK SHERBOURNE,,,2.00625,0.165125,,,362100,181100
STOKE BRUERNE STW F/E,,,,,3.916666667,,474900,249800
STOKE BY CLARE STW F/E,,,,,20.5,,574708,243495
STOKE CLIMSLAND STW FE,,,,,16.41666667,,235847,74027
STOKE DOYLE BROOK - GB105032045220,,,6.024875,0.111125,,,502393,286204
STOKE FERRY AWS WTW,,,,,3.666666667,,570230,298830
STOKE FERRY STW F/E,,,,,12.58333333,,570090,299490
STOKE FLEMING STW,,,,,67.75,,287010,49550
STOKE GOLDINGTON STW F/E,,,,,15.33333333,,484800,248800
STOKE HILL (CRAPSTONE) STW FE,,,,,10.58333333,,250600,67300
STOKE HILL LANDFILL SITE  STOKE CANON,,,,,6.85,,294500,97000
STOKE HOLY CROSS STW F/E,,,,,26.9,,622900,302900
STOKE LACY (WESTBURY)STW.,,,,,19.2,,362380,250470
STOKE ST GREGORY STW FE,,,,,18,,333810,127311
STOKE STW,,,,,17.25,,584140,175160
STOKES BAY (16700),,32.6,,,,,460000,97900
STOKESLEY STW,,,,,15.84090909,,452300,507750
STONE BK.TRIB.OUSE STONE BR.B1043 RD.BR.,,,10.47,0.35,,,516624,254603
STONE BRDIGE DRAIN TRIB TETNEY,,3113.714286,1.027642857,1.540714286,,,535470,403080
STONE BRIDGE DRN.HALE BRIDGE BOTTOM,,,5.159125,0.1615,,,534242,350765
STONE BRIDGE DRN.NORTHLANDS,,,4.844875,0.16,,,534440,353220
STONE GREEN STW,,,,,6.75,,594257,127666
STONE STW,,,,,3.946666667,,478100,210600
STONEBRIDGE STP EAST WRETHAM,,,,,92,,592554,290457
STONEGATE BECK AT EGTON BANKS,,,1.68375,0.02225,,,478000,506700
STONELEIGH CLOSE PSTW,,,,,87,,346131,474996
STONEPIT DYKE - GB105032045270,,,4.634,0.0688,,,502964,293180
STONESBY SPRING GWQN (BESCABY S1),,,5.98,0.065,,,482030,324730
STONETHWAITE STW HUMUS TANK EFFLUENT,,,,,7.7725,,325933,514083
STONEY BRIGG FARM B/H E12/04,,,0.196,0.01,,,458706,391884
STONHAM ASPAL STW F/E,,,,,5.75,,612750,259500
STONTON BK. THORPE LANGTON FORD,,,3.951818182,0.113363636,,,474300,292900
STONTON BK.GAUGING STATION NR.WELLAND,,,4.537375,0.207375,19.175,,475900,291900
STONTON BK.MILL FARM STONTON WYVILLE,,,4.766,0.105083333,,,473500,294600
STONTON BK.NOSELEY GOADBY RD.BR.,,,4.633333333,0.171,,,474487,298944
STONTON BK.THORPE LANGTON,,,4.251428571,0.191771429,9.077142857,,475010,292461
STONTON BROOK,,,5.600909091,0.031454545,,,473732,301196
STONY HALL C 25-3-343,,,4.68,0.033,,,432570,529550
STONY HALL L 25-3-344,,,0.196,0.01,,,432570,529550
STORRINGTON STW FINAL EFFLUENT,,,,,5.95,,507540,115410
STORT ABOVE TWYFORD MILL LOCK,,,8.075,0.09675,,,549419,219270
STORT AT BURNT MILL,,,8.50625,0.243625,,,544605,211322
STORT AT CANNONS MILL,,,11.15,0.114777778,3.825,,549324,222342
STORT AT GYPSY LANE,,,10.7425,0.08925,,,550362,223918
STORT AT ROYDON,,,8.58125,0.26875,,,540466,210419
STORT AT SAWBRIDGEWORTH,,,10.54625,0.25,,,548790,215025
STORT AT SPELLBROOK WEIR,,,13.73125,0.33875,,,549030,217559
STOTT FOLD FARM RIPON 3380,,,1.75,0.022,,,414500,477500
STOTTESDON STW FE (HT),,,,,1.25,,366750,282990
STOUR (WORCESTER) POLCON 1-OFF,,,,0.438947368,31.11666667,,500000,2
STOUR @ GILLINGHAM (U/S STW),,,5.906666667,0.16,,,380804,126243
STOUR AT BRYANSTON BOATHOUSE,,,4.745714286,0.215714286,,,387951,107466
STOUR AT BRYANSTON SCHOOL,,,4.293333333,0.233333333,,,387717,106747
STOUR AT DORSET SHOWGROUND,,,5.653636364,0.168181818,,,378700,123204
STOUR BK.STURMER BR.,,,12.5575,0.5975,,,569778,243988
STOUR BK.U/S WITHERSFIELD STW,,,20.3375,0.8735,,,565350,247300
STOUR RIVER CHERINGTON,,,8.92375,0.0815,,,428980,236940
STOUR RIVER CLIFFORD CHAMBERS,,,7.74125,0.097125,,,419670,252779
STOUR RIVER HONINGTON BRIDGE,,,8.0775,0.0925,,,426270,242190
STOURPAINE STW FE,,,,,17.91666667,,385530,109650
STOURTON CAUNDLE STW FE,,,,,7.25,,371990,114590
STOWE RIVER BROWNS BRIDGE SOUTHAM (A423),,,3.60225,0.10875,,,441820,261450
STOWE STW F/E,,,,,2.545454545,,467230,236630
STOWLANGTOFT STR.BROOK FARM IXWORTH RD.,,,6.5795,0.25725,,,599195,271215
STOWMARKET STW F/E,,,,,7,,606200,257700
STRATFIELD MORTIMER STW,,,,,12.49705882,,467308,164568
STRATTON - FOSSE STW,,,,,6.818181818,,366396,150915
STRAWBERRY WOOD STREAM,,,7.666666667,0.013,,,359361,159038
STREAM DIKE OUTFALL AT HORNSEA BEACH,,,1.460875,0.083375,,,521070,447484
STREAT WWTW,,,,,15.44166667,,535190,114980
STREATLEY STW,,,,,18.3,,459437,181036
STRESSHOLME (DARLINGTON) STW,,,,,28.5,,428850,511320
STRETE STW FE,,,,,7,,284400,46600
STRETFORD BROOK AT IVINGTON COURT,,,6.1625,0.29,,,346700,256830
STRETFORD STW FINAL EFFLUENT,,,,,22.45454545,,378059,393146
STRETHAM STW F/E,,,,,21,,552040,274250
STRINE BRK. LONGFORD FOOTBRIDGE,,,6.045,0.2375,,,372540,318720
STRINES STW FINAL EFFLUENT,,,,,11.33333333,,397004,387080
STRINGSIDE STR.WHITE BR.OXBOROUGH,,,14.375,0.033375,,,571900,301100
STRONGFORD STW COMBINED FINAL EFF FLOW,,,,,7.916666667,,387670,339229
STROOM DYKE AT WIVERTON HALL,,,10.995,0.4575,9.025,,471843,335715
STRUBBY STW F/E,,,,,12.5,,544720,379072
STUBB MILL PUMP (R.THURNE),,,,,15.14285714,,643800,322000
STUDHAM STW,,,,,4.341666667,,503100,215800
STUDLAND,,,,,5.166666667,,402780,83700
STUDLAND KNOLL HOUSE (19700),,10,,,,,403430,83602
STURGEONS FARM STW WRITTLE,,,,,110,,566268,207007
STURMINSTER NEWTON STW FE,,,,,10.16666667,,379560,114060
STURTON CARR THOMPSON TRACK BRIDGE,,1120,5.45125,0.071875,,,593415,296419
STURTON STW F/E,,,,,17.27272727,,489363,380862
STUTFIELD BROOK AT BLACKACRES BRIDGE,,,3.8,0.2575,,,436205,192943
SUD BROOK OXTON RAKES FARM,,,1.7862,0.0849,,,432435,373992
SUDBURY STW F/E,,,,,14.08333333,,586215,241228
SUFFOLK WATER CO BARSHAM WTW BORES 1,,,,,3.416666667,,640550,289540
SUMMERLEAZE (33500),,103.85,,,,,220380,106620
SUN CLUB TRIB U/S STW,,,1.131,0.06025,,,460254,110063
SUN LANE TIP BURLEY-IN-WHARFEDALE,,,,,8.3,,415445,446811
SUN SALADS INLET A,,,,0.028416667,,,434490,144111
SUN SALADS INLET B,,,,0.028666667,,,434721,144100
SUN SALADS INLET C,,,,0.03225,,,434829,144023
SUN SALADS POINT A,,,,0.141875,3.533333333,5,434510,144050
SUN SALADS POINT B,,,,0.076125,3.766666667,5,434900,144100
SUN SALADS POINT C,,,,0.113875,3.977777778,5.155555556,434930,144080
SUN VALLEY - SHOBDON,,,,,3,,339800,262800
SUNDERLAND BRIDGE (NEW) STW FINAL EFF,,,,,21.29166667,,426360,537600
SUNDERLAND BRIDGE (OLD) STW FINAL EFF,,,,,12.625,,426390,537645
SUNDON LANDFILL SITE TRADE EFFLUENT,,,,,5.95,,503294,228999
SUNLIGHT SERVICES (LAUNDRY) WELL SD59/14,1,,3.1,0.024,,5,351980,493690
SUNNYMEADS (WRAYSBURY 1 SOUTH),1,,0.196,,4.75,5,500297,174603
SUNNYMEADS 1,1,24.63157895,0.196,,9.85,5.45,500438,175302
SUNNYMEADS 2,1,208.15,0.196,,4.25,5,500498,175247
SUNNYMEADS 3,1,551.8,0.196,,6.15,6.1,500748,174973
SUNNYMEADS 5,,43.95,,,,,500642,175470
SUNNYMEADS 6,,44.25,,,,,500608,175318
SUNNYSIDE HOUSING DEVELOPMENT STW :SOUTH,,,,,54.66666667,,419900,203200
SUNNYSIDE RESERVOIR EFFLUENT :HAMPTON,,,,,4.983333333,,512840,168930
SUPREME INNS HOTEL TREATMENT PLANT,,,,,24,,523934,338733
SURFACE WATER AT KNIGHTSTONE CAFE,,1300,,,,,331619,161752
SURFLEET STW F/E,,,,,16.83333333,,525738,329419
SURREY HALL,,,,,13,,535463,144843
SUSSEX DOWNS OUTDOOR CENTRE,,,,,50.66666667,,543264,105464
SUTTERTON STW F/E,,,,,17.5,,527137,335549
SUTTON BENGER BROOK,,,4.2725,0.037875,,,394935,179096
SUTTON BENGER STW,,,,,16.58333333,,395328,178546
SUTTON BINGHAM WTW,,,,,8.666666667,,355680,111710
SUTTON BRIDGE STW F/E,,,,,40.75,,546434,322940
SUTTON HOO SPRING AT SUTTON HOO,,,37,0.022,,,628547,248844
SUTTON ON FOREST (EAST MOOR) WPC WORKS,,,,,17.86666667,,458800,462300
SUTTON ON SEA BEACH TRANSECT (09200),,28.8,,,,,552242,382171
SUTTON ON THE HILL STW FINAL EFFLUENT,,,,,22.5,,423250,333510
SUTTON ST JAMES STW,,,,,6.5,,540450,317890
SUTTON VALENCE STW,,,,,2.033333333,,581113,147852
SUTTON WICK QUARRY MONITORING POINT 1,,,,,4.5,,448844,195056
SWAFFHAM PRIOR STW F/E,,,,,2.727272727,,556400,264300
SWAFFHAM STW F/E,,,,,5.181818182,,583529,306545
SWAINBY STW,,,,,14.375,,447800,502800
SWAINS FORD FISH FARM OUTLET,,,,,12,,381350,130780
SWALE 01 :SOURCE TO RICHMOND BR - AD HOC,1.155555556,,,0.055714286,6.61,82.77777778,416954,500588
SWALE 02: RICHMOND BR TO URE CF- AD  HOC,,,,,141.375,,443062,465978
SWALE AT A684 MORTON-ON-SWALE,,,1.701714286,0.039857143,,,431874,491781
SWALE AT BROMPTON LAKES FOOTBRIDGE,,,0.879,0.092125,,,420738,499689
SWALE AT CATTERICK,,,1.161142857,0.063285714,,,422670,499334
SWALE AT DISUSED RAILWAY BRIDGE EASBY,,,0.48475,0.010125,,,418378,499879
SWALE AT DOWNHOLME BRIDGE,,,0.361,0.01,,,411343,499155
SWALE AT HOLME,,,3.100909091,0.065454545,,,436441,481615
SWALE AT MAUNBY,,,2.5075,0.05425,,,434742,486178
SWALE TRIB: BARNEY BECK SYSTEM - AD HOC,2.22,,,,3,85.8,401579,498469
SWALE TRIB: COD BECK - AD HOC,,,,3,70,,441469,474853
SWALECLIFFE BROOK,,2340.833333,3.949166667,0.151666667,32.85,,613451,167259
SWALECLIFFE SEA OUTFALL,,,,,16.375,,613350,167300
SWALECLIFFE SLUICE,,1963.166667,,,,,613550,167475
SWALLOWCLIFFE STREAM U/S OF RAILWAY,,,4.846363636,0.175454545,,,395305,129409
SWAN BROOK,,4311.111111,,,,,403143,78831
SWANAGE CENTRAL (19800),,18.4,,,,,403102,79303
SWANAGE STW,,,,,5,,403550,78630
SWANBOURNE STW F/E,,,,,10.75,,479690,227820
SWANPOOL BEACH (28700),,80.1,,,,,180320,31260
SWANSPOOL BK.B573 RD.BR.WELLINGBORO,,,5.277142857,0.066571429,,,490307,267664
SWANTON MORLEY STW F/E,,,,,8.583333333,,601300,318300
SWARDESTON STW F/E,,,,,9.166666667,,619700,302800
SWARTH BECK PTC RIVER KEER,,,1.728,0.159,,,353494,471790
SWATON EAU,,,5.714166667,0.11575,,,516223,336018
SWATTENDEN CENTRE STW,,,,,13.13333333,,577150,134155
SWAY STW,,,,,12.03333333,,428822,96503
SWILL BROOK AT COBBS LANE,,,7.739,0.192,,,371509,351219
SWINDALE BECK 20M U/S TRIB SWINDALE FARM,,,0.004,0.001,,,350743,512360
SWINDALE BECK AT ROSGILL MOOR BRIDGE,,,0.004,0.001,,,352594,514956
SWINDALE BECK NR KNOCK PIKE,,,0.304,0.001825,,,368937,528137
SWINDALE BECK NR STUBBY HEST,,,0.004,0.0013,,,352189,514363
SWINDEN QUARRY - LINTON,,,,,6.933333333,,398741,461589
SWINDERBY (FORMALLY RAF) STW F/E,,,,,7.583333333,,490016,361941
SWINDERBY QUARRY SETTLEMENT LAGOONS,,,,,3,,488408,361255
PYMMES BROOK R.H. CHANNEL AT FERRY LANE,,,14.1725,0.5675,,,534707,189464
PYTCHLEY STW F/E,,,,,3.583333333,,486260,274124
PYWORTHY STW FE,,,,,8.166666667,,230400,103200
Q/HAMPTON R TEST ABOVE PORTALS,,,9.1375,0.030416667,3.933333333,,451768,150237
QUAGGY AT MANOR PARK,,,3.63625,0.4125,4.25,,539400,174800
QUEEN ELIZABETH BARRACKS STW - STRENSALL,,,,,5.925,,464843,458851
QUEENBOROUGH STW FINAL EFF,,,,,18,,590850,170250
QUENDON STW F/E,,,,,6.916666667,,552000,231200
QUENIBOROUGH BK AT CONF WITH GADDESBY BK,,,3.976666667,0.201428571,11.57142857,,464378,313052
QUENIBOROUGH BROOK AT CONF WITH R.WREAK,,,4.485166667,0.142857143,5.828571429,,462877,313026
QUETHIOCK STW FE,,,,,7,,231400,64700
QUIN AT BRAUGHING BRIDGE,,,11.05818182,0.129166667,5.866666667,,539200,224800
QUORN BROOK AT MILL FARM,,,4.715,0.125,,,455641,315826
QUORN BROOK AT QUORN,,,4.37875,0.1605,5.3625,,456374,316499
R ADUR EAST FAIRPLACE BRIDGE,,,2.7275,0.090625,,,530600,120400
R ADUR EAST MOCK BRIDGE,,,8.08,0.140625,,,521000,118300
R ADUR EAST ROAD BRIDGE,,,14.43625,0.360125,,,525600,120400
R ADUR EAST WYNDHAM FARM RD BR,,,8.00125,0.187125,,,523600,119600
R ADUR TRIB KINGS BARN,,,8.177142857,0.421428571,,,518730,111820
R ADUR WEST BAY BRIDGE,,,1.7235,0.1145,,,516500,120700
